id,Question,Option A,Option B,Option C,Option D,Correct Answer
1,What is the powerhouse of the cell?,Nucleus,Mitochondria,Ribosome,Chloroplast,B
2,Which macromolecule is primarily responsible for storing genetic information?,Protein,Lipid,Carbohydrate,Nucleic Acid,D
3,Which blood cells help in clotting?,Red Blood Cells,White Blood Cells,Platelets,Plasma,C
4,What gas do plants absorb during photosynthesis?,Oxygen,Carbon Dioxide,Nitrogen,Hydrogen,B
5,Which organ filters blood in the human body?,Heart,Liver,Kidney,Lungs,C